{
  "$schema": "https://json-schema.org/draft/2020-12/schema",
  "$id": "https://schemas.harness.invalid/config.client.schema.json",
  "title": "drogna browser client runtime configuration",
  "description": "The document the browser client (C-18) fetches before it opens any transport, and the only place a location may be named for it. A browser reads no environment variable, so the single-variable rule of NFR-04 becomes a single served document reached by one relative bootstrap URL, which is the client's one permitted literal and carries an inline exemption marker naming this schema. Nothing here can light a component: the document names where to listen and how long to keep believing what was heard, and Constitution VII means illumination comes from received heartbeats and nothing else. A window is a tolerance, not a claim that a component exists.",
  "type": "object",
  "required": ["broker", "clock", "liveness", "display", "query"],
  "additionalProperties": false,
  "properties": {
    "broker": {
      "title": "Broker connection",
      "description": "How the browser reaches the control namespace: an MQTT-over-WebSockets connection through the reverse proxy's upgrade location (ADR-0008). The identity is subscribe-only; the client publishes on no topic.",
      "type": "object",
      "required": ["url", "client_id"],
      "additionalProperties": false,
      "properties": {
        "url": {
          "type": "string",
          "format": "uri",
          "description": "WebSocket URL of the proxy's upgrade location. Not the broker's own port: everything stays behind one reverse proxy under one policy."
        },
        "client_id": {
          "type": "string",
          "pattern": "^[a-z][a-z0-9_-]*$",
          "description": "The MQTT client identifier. Deterministic, never derived from entropy or a host clock (Constitution II). Two viewers served the same identifier will disconnect one another, so a deployment that expects several viewers issues a distinct identifier per served document."
        },
        "keepalive_seconds": {
          "type": "integer",
          "exclusiveMinimum": 0,
          "description": "Transport keepalive. A socket parameter, not simulation time."
        },
        "reconnect_period_seconds": {
          "type": "number",
          "minimum": 0,
          "description": "How long the transport waits before retrying a dropped connection. Zero disables retrying."
        }
      }
    },
    "clock": {
      "title": "Simulation clock",
      "description": "Simulation time arrives by subscription to ctl/clock (ADR-0009). The HTTP interface is used for two things: asking what the time is at startup, so the page is not blank until the next sample, and asking the clock for a rate. The rate control is the browser's by SRD FR-10 and FR-49, and a rate of zero pins the clock for a capture (FR-53). It is a request and never an assertion: the rate the page displays is the one the clock reports in force on ctl/clock, never the one that was asked for. Where the control route is absent the page still renders the control and says why it cannot act, rather than appearing to act and doing nothing.",
      "type": "object",
      "required": ["stale_after_seconds"],
      "additionalProperties": false,
      "properties": {
        "stale_after_seconds": {
          "type": "number",
          "exclusiveMinimum": 0,
          "description": "How long, in host seconds, the client waits for a time sample before reporting the clock stale. Staleness is the absence of samples and is not the same as a rate of zero, which is a state the clock reports and which stops emission legitimately (FR-53)."
        },
        "endpoint": {
          "type": "string",
          "description": "Base URL of the clock service's HTTP interface as the browser reaches it. Empty means the page's own origin — the one-door topology routes the clock through the proxy (ADR-0025), and a relative URL is what keeps the request same-origin whatever host name the viewer arrived by; an absolute URL naming a different host is preflighted, and a preflight carries no credential, so the boundary's clearance refuses it before the clock is ever asked. Absent means the client waits for the first sample instead."
        },
        "routes": {
          "type": "object",
          "required": ["snapshot"],
          "additionalProperties": false,
          "description": "Routes relative to the endpoint. The read route is required; the control route is optional, because a destination may serve a page that can watch the clock without being able to set it.",
          "properties": {
            "snapshot": {
              "type": "string",
              "description": "What the time is now, for a page that has just loaded."
            },
            "control": {
              "type": "string",
              "description": "Where a rate change is asked for, by POST. The clock decides; a request may be clamped or refused, and the display shows the rate the clock reports in force rather than the rate that was asked for (SRD FR-10, FR-49, FR-53)."
            }
          }
        }
      }
    },
    "query": {
      "title": "Query layer",
      "description": "Where the client reads the forecast, the uncertainty field and the conditions along a recommended route, through the reverse proxy under one path policy (ADR-0008, Constitution X). Freshness is never discovered here: a new run is announced on ctl/run-published and the client reads only when it has been told there is something new (SRD FR-31). The collection identifiers are not configured — they arrive in the announcement, so publishing a run adds collections without any document being edited.",
      "type": "object",
      "required": ["endpoint", "collections_path"],
      "additionalProperties": false,
      "properties": {
        "endpoint": {
          "type": "string",
          "description": "Base URL of the query layer as the browser reaches it: the boundary, never the query layer's own port. Empty means the page's own origin, which is the boundary once the page is served through it — and is the only form a browser can read the answer of, since the released prefix sends no CORS grant and a cross-origin read is refused by the viewer's own browser however the request fares."
        },
        "collections_path": {
          "type": "string",
          "description": "Path under the endpoint at which collections are addressed. A collection identifier from a run announcement is appended to it."
        },
        "trajectory_path": {
          "type": "string",
          "description": "Path under a collection at which an OGC API-EDR trajectory query is served. Per-vertex arrival times travel as the M ordinate of a WKT LINESTRING ZM in the coords parameter (SRD FR-20). Absent where the destination does not serve trajectory queries, in which case the route renders without conditions along it rather than with conditions for the wrong moment."
        },
        "route_parameters": {
          "type": "array",
          "description": "Which forecast parameters to ask for along a route. Named here rather than in source because what a destination serves is a property of the destination.",
          "items": { "type": "string", "minLength": 1 }
        },
        "cube_path": {
          "type": "string",
          "description": "Path under a collection at which an OGC API-EDR cube query is served. The map asks for one cube per announcement, at the extent the announcement stated, and draws that. Absent where the destination does not serve cube queries, in which case the map renders the extent and states that no field can be read rather than drawing a field it did not fetch."
        },
        "field_parameter": {
          "type": "string",
          "minLength": 1,
          "description": "Which parameter the map draws as the uncertainty field. Named here for the same reason route_parameters is: which parameter carries the ensemble spread is a property of what the destination serves, not of the client. Absent means the map has not been told what to draw and says so."
        }
      }
    },
    "liveness": {
      "title": "Liveness tolerances",
      "description": "How long a received heartbeat is taken as evidence, when its sender did not declare that itself. Real time by ADR-0006: a rate of zero stops simulated time and stops nothing else, so a pinned clock keeps its lit components lit for the duration of a capture.",
      "type": "object",
      "required": ["default_window_seconds"],
      "additionalProperties": false,
      "properties": {
        "default_window_seconds": {
          "type": "number",
          "exclusiveMinimum": 0,
          "description": "The window applied to a heartbeat that declares neither a window nor an interval. One scalar tolerance, deliberately not a table of components: a table would be a list of what ought to exist, which is what Constitution VII forbids."
        },
        "window_multiplier": {
          "type": "number",
          "exclusiveMinimum": 1,
          "description": "Applied to a declared interval when the sender declares an interval but no window: a sender that says it speaks every n seconds is believed for a small multiple of n, so one dropped message is not read as death."
        },
        "disconnected_is_indeterminate": {
          "type": "boolean",
          "description": "Whether evidence that expires while the transport is down renders as indeterminate rather than dark. Default true: a client that has gone deaf cannot honestly say a component died. It can never light anything — indeterminate is not lit."
        }
      }
    },
    "display": {
      "title": "Display",
      "description": "Rendering settings, and nothing that changes what is believed. A high clock rate degrades the frame rate and never the truth: every received heartbeat is folded into liveness state whether or not a frame is drawn for it.",
      "type": "object",
      "required": ["frame_interval_ms"],
      "additionalProperties": false,
      "properties": {
        "frame_interval_ms": {
          "type": "number",
          "exclusiveMinimum": 0,
          "description": "Minimum host milliseconds between re-renders. The frame budget, not a sampling interval for liveness."
        },
        "buffer_depth": {
          "type": "integer",
          "exclusiveMinimum": 0,
          "description": "How many messages each control topic keeps, oldest evicted first, so an hour of demonstration has a stable memory footprint. It bounds how far back a viewer can read and can neither light a component nor draw a transit."
        },
        "coalescing_threshold": {
          "type": "integer",
          "exclusiveMinimum": 0,
          "description": "How many arrivals in one frame before transits on the same boundary are drawn as one mark carrying the count. A display bound: it changes how many marks are drawn and never how many messages are counted."
        },
        "maximum_drawn_cells": {
          "type": "integer",
          "exclusiveMinimum": 0,
          "description": "The largest number of uncertainty cells drawn before the field is downsampled. The resolution actually shown is stated on the display, never reduced silently."
        },
        "interpolate_between_samples": {
          "type": "boolean",
          "description": "Whether the render path may smooth the display between two received clock samples using the browser's animation frame timestamp, under the three rules of ADR-0007. False renders on clock samples alone, which costs smoothness and nothing else."
        }
      }
    }
,
    "map": {
      "title": "Map surface",
      "description": "Where the scenario is, for a surface that must not invent geography. The extent a run's field is drawn in comes from the announcement's own grid bounds and never from here; this is what the map has to draw before any run has been announced, which is the state a harness whose loop has not yet turned is honestly in. Optional: a document that omits it renders the statement that no extent has been served rather than failing to start, and a client that has neither an announcement nor a declaration draws no frame at all.",
      "type": "object",
      "required": ["extent"],
      "additionalProperties": false,
      "properties": {
        "extent": {
          "title": "Declared scenario extent",
          "description": "The destination's declaration of the scenario's horizontal extent, in CRS84 degrees. The same numbers the destination declares as its domain elsewhere; declared again here because the client cannot read that document and cannot enumerate collections through the boundary.",
          "type": "object",
          "required": [
            "minimum_longitude",
            "minimum_latitude",
            "maximum_longitude",
            "maximum_latitude"
          ],
          "additionalProperties": false,
          "properties": {
            "minimum_longitude": { "type": "number", "minimum": -180, "maximum": 180 },
            "minimum_latitude": { "type": "number", "minimum": -90, "maximum": 90 },
            "maximum_longitude": { "type": "number", "minimum": -180, "maximum": 180 },
            "maximum_latitude": { "type": "number", "minimum": -90, "maximum": 90 }
          }
        },
        "vertical": {
          "title": "Declared vertical range",
          "description": "The depth range the scenario covers, in metres, positive downwards, as the coverage's own vertical convention has it. Used to label the volume mode's depth axis before a run has been announced.",
          "type": "object",
          "required": ["minimum_depth_m", "maximum_depth_m"],
          "additionalProperties": false,
          "properties": {
            "minimum_depth_m": { "type": "number", "minimum": 0 },
            "maximum_depth_m": { "type": "number", "minimum": 0 }
          }
        },
        "graticule_spacing_degrees": {
          "type": "number",
          "exclusiveMinimum": 0,
          "description": "Spacing of the graticule the map draws, in degrees. Absent means the map chooses a spacing from the extent's own span, which is what keeps a wide extent from being drawn as a black rectangle of meridians."
        }
      }
    }
  }
}
